{
  "$schema": "./schemas/periodic-nudge.schema.json",
  "nudge_id": "NUDGE-DOCS-REVIEW-20260503",
  "reason": "docs/security/dependency_exceptions.md next_review_dueが2026-05-17、30日overdue threshold接近",
  "target_kind": "docs",
  "target_ref": "docs/security/dependency_exceptions.md",
  "suggested_action": "Review dependency exceptions registry and update next_review_due",
  "created_at": "2026-05-03T00:00:00Z",
  "priority": "medium",
  "stale_days": 16,
  "threshold_days": 30,
  "category": "review_due",
  "blocking": false,
  "expires_at": "2026-05-17T00:00:00Z",
  "schema_version": "1.0.0"
}